<?xml version="1.0" encoding="UTF-8"?>
<?xml-stylesheet type="text/css" href="xml1.css"?>
<!DOCTYPE Special SYSTEM "xml2.dtd">
<Specialization>
    <Information>Информация о специальности ИСиТ</Information>
    <University>
        <Name>БГТУ</Name>
        <Point>320 баллов</Point>
        <Plan>90 мест</Plan>
        <City>Минск</City>
    </University>
    <University>
        <Name>БГУиР</Name>
        <Point>337 баллов</Point>
        <Plan>60 мест</Plan>
        <City>Минск</City>
    </University>
    <University>
        <Name>БГУ</Name>
        <Point>330 баллов</Point>
        <Plan>30 мест</Plan>
        <City>Минск</City>
    </University>
    <University>
        <Name>БарГУ</Name>
        <Point>266 баллов</Point>
        <Plan>30 мест</Plan>
        <City>Барановичи</City>
    </University>
</Specialization>
